label,sentence
2,Possibly not since Grumpy Old Men have I heard a film so solidly connect with one demographic while striking out with another.
3,What a great way to spend 4 units of your day.
4,A passionately inquisitive film determined to uncover the truth and hopefully inspire action.
4,Both a successful adaptation and an enjoyable film in its own right.
3,And Vin Diesel is the man.
1,Just a Kiss is a just a waste.
2,"Meyjes focuses too much on Max when he should be filling the screen with this tortured, dull artist and monster-in-the- making."
2,Hilarious musical comedy though stymied by accents thick as mud.
1,Murder by Numbers just doesn't add up.
1,"All three descriptions suit Evelyn, a besotted and obvious drama that tells us nothing new."
3,"This is popcorn movie fun with equal doses of action, cheese, ham and cheek (as well as a serious debt to The Road Warrior), but it feels like unrealized potential"
2,"(It) highlights not so much the crime lord's messianic bent, but Spacey's."
3,"In Death to Smoochy, we don't get Williams' usual tear and a smile, just sneers and bile, and the spectacle is nothing short of refreshing."
2,"Tsai has managed to create an underplayed melodrama about family dynamics and dysfunction that harks back to the spare, unchecked heartache of Yasujiro Ozu."
1,An uneven mix of dark satire and childhood awakening.
0,The movie is about as humorous as watching your favorite pet get buried alive.
0,Bears is even worse than I imagined a movie ever could be.
0,Dramatically lackluster.
3,made Eddie Murphy a movie star and the man hasn't aged a day.
4,This is an undeniably intriguing film from an adventurous young talent who finds his inspiration on the fringes of the American underground.
3,"Yes, MIBII is rote work and predictable, but with a philosophical visual coming right at the end that extravagantly redeems it."
1,Their contrast is neither dramatic nor comic -- it's just a weird fizzle.
1,All the characters are clinically depressed and have abandoned their slim hopes and dreams.
0,"Tartakovsky's team has some freakish powers of visual charm, but the five writers slip into the modern rut of narrative banality."
3,"A gently funny, sweetly adventurous film that makes you feel genuinely good, that is to say, entirely unconned by false sentiment or sharp, overmanipulative Hollywood practices."
1,"Tries too hard to be funny in a way that's too loud, too goofy and too short of an attention span."
3,The obnoxious title character provides the drama that gives added clout to this doc.
2,"The Sweetest Thing, a romantic comedy with outrageous tendencies, may be a mess in a lot of ways."
1,"You emerge dazed, confused as to whether you've seen pornography or documentary."
1,"Lucy's a dull girl, that's all."
4,Sensitive ensemble performances and good period reconstruction add up to a moving tragedy with some buoyant human moments.
1,"Directed without the expected flair or imagination by Hong Kong master John Woo, Windtalkers airs just about every cliche in the war movie compendium across its indulgent two-hour-and-fifteen-minute length."
3,"It looks closely, insightfully at fragile, complex relationships."
1,The story has some nice twists but the ending and some of the back-story is a little tired.
1,is an inexpressible and drab wannabe looking for that exact niche.
1,"The Mothman Prophecies, which is mostly a bore, seems to exist only for its climactic setpiece."
3,"Spirit is a visual treat, and it takes chances that are bold by studio standards, but it lacks a strong narrative."
3,This is one of the rarest kinds of films: a family-oriented non-Disney film that is actually funny without hitting below the belt.
3,"For almost the first two-thirds of Martin Scorsese's 168-minute Gangs of New York, I was entranced."
0,"...a cheap, ludicrous attempt at serious horror."
0,"An unremittingly ugly movie to look at, listen to, and think about, it is quite possibly the sturdiest example yet of why the DV revolution has cheapened the artistry of making a film."
4,Enticing and often funny documentary.
0,But one thing's for sure: It never comes close to being either funny or scary.
1,The movie eventually snaps under the strain of its plot contrivances and its need to reassure.
3,"Whereas Oliver Stone's conspiracy thriller JFK was long, intricate, star-studded and visually flashy, Interview with the Assassin draws its considerable power from simplicity."
3,The Komediant is a tale worth catching.
1,"The holes in this film remain agape -- holes punched through by an inconsistent, meandering, and sometimes dry plot."
3,Worth seeing just for Weaver and LaPaglia.
2,"A brain twister, less a movie-movie than a funny and weird meditation on Hollywood, success, artistic integrity and intellectual bankruptcy."
2,Let's hope not.
1,"It follows the Blair Witch formula for an hour, in which we're told something creepy and vague is in the works, and then it goes awry in the final 30 minutes."
3,An encouraging effort from McCrudden
4,"I was amused and entertained by the unfolding of Bielinsky's cleverly constructed scenario, and greatly impressed by the skill of the actors involved in the enterprise."
4,"Such master screenwriting comes courtesy of John Pogue, the Yale grad who previously gave us ""The Skulls"" and last year's ""Rollerball."""
3,"Initially gripping, eventually cloying POW drama."
1,This is not a Jackie Chan movie.
4,Chamber of Secrets will find millions of eager fans.
2,"You can see the would-be surprises coming a mile away, and the execution of these twists is delivered with a hammer."
1,Lacks the visual flair and bouncing bravado that characterizes better hip-hop clips and is content to recycle images and characters that were already tired 10 years ago.
1,"A timid, soggy near miss."
3,"A solidly constructed, entertaining thriller that stops short of true inspiration."
3,A quiet family drama with a little bit of romance and a dose of darkness.
3,"Smith examines the intimate, unguarded moments of folks who live in unusual homes -- which pop up in nearly every corner of the country."
1,"I admire it and yet cannot recommend it, because it overstays its natural running time."
1,Thoroughly engrossing and ultimately tragic.
0,I can analyze this movie in three words: Thumbs Friggin' Down.
1,"If only it were, well, funnier."
0,"It is messy, uncouth, incomprehensible, vicious and absurd."
3,"From its invitingly upbeat overture to its pathos-filled but ultimately life-affirming finale, Martin is a masterfully conducted work."
1,Charly comes off as emotionally manipulative and sadly imitative of innumerable past Love Story derisions.
0,Kung Pow seems like some futile concoction that was developed hastily after Oedekerk and his fellow moviemakers got through crashing a college keg party.
1,"Its premise is smart, but the execution is pretty weary."
3,An engrossing Iranian film about two itinerant teachers and some lost and desolate people they encounter in a place where war has savaged the lives and liberties of the poor and the dispossessed.
0,"for those for whom the name Woody Allen was once a guarantee of something fresh, sometimes funny, and usually genuinely worthwhile, Hollywood Ending is a depressing experience"
1,"Somewhere inside the mess that is World Traveler, there is a mediocre movie trying to get out."
4,"First and foremost...the reason to go see ""Blue Crush"" is the phenomenal, water-born cinematography by David Hennings."
3,Connoisseurs of Chinese film will be pleased to discover that Tian's meticulous talent has not withered during his enforced hiatus.
3,"Gaunt, silver-haired and leonine, (Harris) brings a tragic dimension and savage full-bodied wit and cunning to the aging Sandeman."
3,"Left me with the visceral sensation of longing, lasting traces of Charlotte's web of desire and desperation."
1,"The problem with The Bread, My Sweet is that it's far too sentimental."
2,It may even fall into the category of Films You Love to Hate.
3,Combines a comically dismal social realism with a farcically bawdy fantasy of redemption and regeneration.
2,Like a less dizzily gorgeous companion to Mr. Wong's In the Mood for Love -- very much a Hong Kong movie despite its mainland setting.
0,"Loud, chaotic and largely unfunny."
0,"The main characters are simply named The Husband, The Wife and The Kidnapper, emphasizing the disappointingly generic nature of the entire effort."
1,A Movie to Forget
2,"The film's best trick is the way that it treats conspiracy as a kind of political Blair Witch, a monstrous murk that haunts us precisely because it can never be seen."
1,Rife with nutty cliches and far too much dialogue.
2,"LaBute can't avoid a fatal mistake in the modern era: He's changed the male academic from a lower-class Brit to an American, a choice that upsets the novel's exquisite balance and shreds the fabric of the film."
1,"Starts out with tremendous promise, introducing an intriguing and alluring premise, only to fall prey to a boatload of screenwriting cliches that sink it faster than a leaky freighter."
3,A raunchy and frequently hilarious follow-up to the gifted Korean American stand-up's I'm the One That I Want.
3,"A completely spooky piece of business that gets under your skin and, some plot blips aside, stays there for the duration."
1,An artful yet depressing film that makes a melodramatic mountain out of the molehill of a missing bike.
1,"The movie ends with outtakes in which most of the characters forget their lines and just utter 'uhhh,' which is better than most of the writing in the movie."
2,"Every five minutes or so, someone gets clocked."
0,"If that doesn't clue you in that something's horribly wrong, nothing will."
0,This loud and thoroughly obnoxious comedy about a pair of squabbling working-class spouses is a deeply unpleasant experience.
1,It's not an easy one to review.
1,"Ultimately, in the history of the Academy, people may be wondering what all that jazz was about ""Chicago"" in 2002."
2,A puzzling experience.
4,The film has a terrific look and Salma Hayek has a feel for the character at all stages of her life.
3,"What makes Barbershop so likable, with all its flaws, is that it has none of the pushiness and decibel volume of most contemporary comedies."
2,"It pulls the rug out from under you, just when you're ready to hate one character, or really sympathize with another character, something happens to send you off in different direction."
1,"This is for the most part a useless movie, even with a great director at the helm."
3,(Reaches) wholly believable and heart-wrenching depths of despair.
3,"The film fearlessly gets under the skin of the people involved ... This makes it not only a detailed historical document, but an engaging and moving portrait of a subculture."
2,Gibney and Jarecki just want to string the bastard up.
1,"For a movie about the power of poetry and passion, there is precious little of either."
1,"Unfortunately, we'd prefer a simple misfire."
2,"When in doubt, the film ratchets up the stirring soundtrack, throws in a fish-out-of-water gag and lets the cliched dialogue rip."
4,...a true delight.
0,An awful snooze.
1,Doesn't really add up to much.
4,"An interesting psychological game of cat-and-mouse, three-dimensional characters and believable performances all add up to a satisfying crime drama."
4,"A new film from Bill Plympton, the animation master, is always welcome."
1,"Watching ""Ending"" is too often like looking over the outdated clothes and plastic knickknacks at your neighbor's garage sale."
2,A thriller made from a completist's checklist rather than with a cultist's passion.
0,"Cox offers plenty of glimpses at existing photos, but there are no movies of Nijinsky, so instead the director treats us to an aimless hodgepodge."
2,May be the most undeserving victim of critical overkill since Town and Country.
1,"Its weighty themes are too grave for youngsters, but the story is too steeped in fairy tales and other childish things to appeal much to teenagers."
1,"Nothing happens, and it happens to flat characters."
1,Leaves us wondering less about its ideas and more about its characterization of Hitler and the contrived nature of its provocative conclusion.
1,"""White Oleander,"" the movie, is akin to a Reader's Digest condensed version of the source material."
3,"High drama, Disney-style - a wing and a prayer and a hunky has-been pursuing his castle in the sky."
2,"Has its moments, but it's pretty far from a treasure."
2,Goes a long way on hedonistic gusto.
1,"Schnieder bounces around with limp wrists, wearing tight tummy tops and hip huggers, twirling his hair on his finger and assuming that's enough to sustain laughs..."
3,A wonderfully speculative character study that made up for its rather slow beginning by drawing me into the picture.
2,Matches neorealism's impact by showing the humanity of a war-torn land filled with people who just want to live their lives.
2,The central character isn't complex enough to hold our interest.
4,"It's the kind of movie that, aside from Robert Altman, Spike Lee, the Coen Brothers and a few others, our moviemakers don't make often enough."
3,The action sequences are fun and reminiscent of combat scenes from the Star Wars series.
3,"The work of an exhausted, desiccated talent who can't get out of his own way."
1,The problem is that Van Wilder does little that is actually funny with the material.
1,No cliche escapes the perfervid treatment of gang warfare called ces Wild.
2,Acting cannot be acted.
1,Comes off like a bad imitation of the Bard.
1,The Sweetest Thing leaves an awful sour taste.
4,It's a great American adventure and a wonderful film to bring to IMAX.
1,Resembles a soft porn Brian De Palma pastiche.
2,"The director and her capable cast appear to be caught in a heady whirl of New Age-inspired good intentions, but the spell they cast isn't the least bit mesmerizing."
2,A movie that feels like the pilot episode of a new teen-targeted action TV series.
3,A uniquely sensual metaphorical dramatization of sexual obsession that spends a bit too much time on its fairly ludicrous plot.
3,The sentimental cliches mar an otherwise excellent film.
1,Hollywood has taken quite a nosedive from Alfred Hitchcock's imaginative flight to Shyamalan's self-important summer fluff.
0,This is standard crime drama fare... instantly forgettable and thoroughly dull.
2,You won't look at religious fanatics -- or backyard sheds -- the same way again.
2,The combination of lightness and strictness in this instance gives Italian for Beginners an amiable aimlessness that keeps it from seeming predictably formulaic.
3,Eyre is on his way to becoming the American Indian Spike Lee.
3,"In questioning the election process, Payami graphically illustrates the problems of fledgling democracies, but also the strength and sense of freedom the Iranian people already possess, with or without access to the ballot box."
2,"Not bad, but not all that good."
0,"There's a scientific law to be discerned here that producers would be well to heed: Mediocre movies start to drag as soon as the action speeds up; when the explosions start, they fall to pieces."
0,"Borstal Boy represents the worst kind of filmmaking, the kind that pretends to be passionate and truthful but is really frustratingly timid and soggy."
2,"Old people will love this movie, and I mean that in the nicest possible way: Last Orders will touch the heart of anyone old enough to have earned a 50-year friendship."
3,"So genial is the conceit, this is one of those rare pictures that you root for throughout, dearly hoping that the rich promise of the script will be realized on the screen."
0,The only entertainment you'll derive from this choppy and sloppy affair will be from unintentional giggles – several of them.
1,The Good Girl is a film in which the talent is undeniable but the results are underwhelming.
0,More of the same old garbage Hollywood has been trying to pass off as acceptable teen entertainment for some time now.
3,Amazingly dopey.
1,The Christ allegory doesn't work because there is no foundation for it
1,Romanek keeps adding flourishes -- artsy fantasy sequences -- that simply feel wrong.
3,"Combines improbable melodrama (gored bullfighters, comatose ballerinas) with subtly kinky bedside vigils and sensational denouements, and yet at the end, we are undeniably touched."
2,"There's a thin line between likably old-fashioned and fuddy-duddy, and The Count of Monte Cristo ... never quite settles on either side."
3,"You don't need to be a hip-hop fan to appreciate Scratch, and that's the mark of a documentary that works."
0,"I'm not sure which half of Dragonfly is worse: The part where nothing's happening, or the part where something's happening, but it's stupid."
4,"Writer/director David Caesar ladles on the local flavour with a hugely enjoyable film about changing times, clashing cultures and the pleasures of a well-made pizza."
3,"The journey to the secret's eventual discovery is a separate adventure, and thrill enough."
1,Roman Polanski directs The Pianist like a surgeon mends a broken heart; very meticulously but without any passion.
4,"It's soulful and unslick, and that's apparently just what (Aniston) has always needed to grow into a movie career."
4,"Like blended shades of lipstick, these components combine into one terrific story with lots of laughs."
3,Devos delivers a perfect performance that captures the innocence and budding demons within a wallflower.
1,Has lost some of the dramatic conviction that underlies the best of comedies...
4,"Tells a fascinating, compelling story."
2,A plodding look at the French Revolution through the eyes of aristocrats.
2,"Ah, what the hell."
1,"Like a comedian who starts off promisingly but then proceeds to flop, Comedian runs out of steam after a half hour."
2,"...gripping and handsome execution, (but) there isn't much about K-19 that's unique or memorable."
1,"One of those films where the characters inhabit that special annex of hell where adults behave like kids, children behave like adults and everyone screams at the top of their lungs no matter what the situation."
1,"Devotees of Star Trek II: The Wrath of Khan will feel a nagging sense of deja vu, and the grandeur of the best Next Generation episodes is lacking."
3,Beautifully reclaiming the story of Carmen and recreating it an in an African idiom.
1,"The punch lines that miss, unfortunately, outnumber the hits by three-to-one."
3,Michel Piccoli's moving performance is this films reason for being.
4,Read My Lips is to be viewed and treasured for its extraordinary intelligence and originality as well as its lyrical variations on the game of love.
1,Those seeking a definitive account of Eisenstein's life would do better elsewhere.
3,"Yes, soar."
3,"As banal as the telling may be -- and at times, All My Loved Ones more than flirts with kitsch -- the tale commands attention."
3,"Although Frailty fits into a classic genre, in its script and execution it is a remarkably original work."
2,It's Young Guns meets Goodfellas in this easily skippable hayseeds-vs.
1,Naipaul fans may be disappointed.
0,Attal pushes too hard to make this a comedy or serious drama.
4,"Poignant and moving, A Walk to Remember is an inspirational love story, capturing the innocence and idealism of that first encounter."
1,"In any case, I would recommend Big Bad Love only to Winger fans who have missed her since 1995's Forget Paris."
4,"... by the time it's done with us, Mira Nair's new movie has its audience giddy with the delight of discovery, of having been immersed in a foreign culture only to find that human nature is pretty much the same all over."
2,The film will appeal to Discovery Channel fans and will surely widen the perspective of those of us who see the continent through rose-colored glasses.
2,You don't want to call the cops.
0,"If there's a heaven for bad movies, Deuces Wild is on its way."
3,"A huge box-office hit in Korea, Shiri is a must for genre fans."
3,"Clint Eastwood's Blood Work is a lot like a well-made PB& J sandwich: familiar, fairly uneventful and boasting no real surprises – but still quite tasty and inviting all the same."
1,The thing about guys like Evans is this: You're never quite sure where self-promotion ends and the truth begins.
1,I found myself growing more and more frustrated and detached as Vincent became more and more abhorrent.
1,It's like an all-star salute to Disney's cheesy commercialism.
2,"""The Tuxedo"" should have been the vehicle for Chan that ""The Mask"" was for Jim Carrey."
0,"Like a bad improvisation exercise, the superficially written characters ramble on tediously about their lives, loves and the art they're struggling to create."
2,I don't even care that there's no plot in this Antonio Banderas-Lucy Liu faceoff.
1,"Though her fans will assuredly have their funny bones tickled, others will find their humor-seeking dollars best spent elsewhere."
0,The first Fatal Attraction was vile enough.
3,A sentimental but entirely irresistible portrait of three aging sisters.
4,"Measured against practically any like-themed film other than its Oscar-sweeping franchise predecessor The Silence of the Lambs, Red Dragon rates as an exceptional thriller."
1,"And as with most late-night bull sessions, eventually the content isn't nearly as captivating as the rowdy participants think it is."
3,...a quietly introspective portrait of the self-esteem of employment and the shame of losing a job...
3,Garcia and the other actors help make the wobbly premise work.
1,It's just plain lurid when it isn't downright silly.
1,Friday After Next is the kind of film that could only be made by African-Americans because of its broad racial insensitivity towards African-Americans.
4,It is also beautifully acted.
1,This dubious product of a college-spawned (Colgate U.) comedy ensemble known as Broken Lizard plays like a mix of Cheech and Chong and CHiPs.
2,"It's all gratuitous before long, as if Schwentke were fulfilling a gross-out quota for an anticipated audience demographic instead of shaping the material to fit the story."
4,"All three actresses are simply dazzling, particularly Balk, who's finally been given a part worthy of her considerable talents."
4,...a powerful sequel and one of the best films of the year.
4,"It's about individual moments of mood, and an aimlessness that's actually sort of amazing."
3,A gift to anyone who loves both dance and cinema
2,"If all of Eight Legged Freaks was as entertaining as the final hour, I would have no problem giving it an unqualified recommendation."
1,"Such a wildly uneven hit-and-miss enterprise, you can't help suspecting that it was improvised on a day-to-day basis during production."
2,"The cameo-packed, M:I-2-spoofing title sequence is the funniest 5 minutes to date in this spy comedy franchise...Then Mike Myers shows up and ruins everything."
1,The new film of Anton Chekhov's The Cherry Orchard puts the 'ick' in 'classic.'
0,"Poor editing, bad bluescreen, and ultra-cheesy dialogue highlight the radical action."
1,"If Welles was unhappy at the prospect of the human race splitting in two, he probably wouldn't be too crazy with his great-grandson's movie splitting up in pretty much the same way."
3,"Passions, obsessions, and loneliest dark spots are pushed to their most virtuous limits, lending the narrative an unusually surreal tone."
3,"Definitely a crowd-pleaser, but then, so was the Roman Colosseum."
3,This story of a determined woman's courage to find her husband in a war zone offers winning performances and some effecting moments.
1,"Well made but uninvolving, Bloodwork isn't a terrible movie, just a stultifyingly obvious one -- an unrewarding collar for a murder mystery."
1,"... expands the horizons of boredom to the point of collapse, turning into a black hole of dullness, from which no interesting concept can escape."
0,As steamy as last week's pork dumplings.
4,"The story itself it mostly told through on-camera interviews with several survivors, whose riveting memories are rendered with such clarity that it's as if it all happened only yesterday."
3,"The Movie is clever, offbeat and even gritty enough to overcome my resistance."
0,"Another week, another gross-out college comedy--ugh."
0,"A laughable -- or rather, unlaughable -- excuse for a film."
2,But even with the two-wrongs-make-a-right chemistry between Jolie and Burns...this otherwise appealing picture loses its soul to Screenwriting For Dummies conformity.
1,Too silly to take seriously.
1,Low comedy doesn't come much lower.
3,It's a very tasteful rock and roll movie.
3,"Meticulously mounted, exasperatingly well-behaved film, which ticks off Kahlo's lifetime milestones with the dutiful precision of a tax accountant."
3,"Davis' candid, archly funny and deeply authentic take on intimate relationships comes to fruition in her sophomore effort."
3,A fast paced and suspenseful Argentinian thriller about the shadow side of play.
2,All Analyze That proves is that there is really only one movie's worth of decent gags to be gleaned from the premise.
0,"Ultimately the, yes, snail-like pacing and lack of thematic resonance make the film more silly than scary, like some sort of Martha Stewart decorating program run amok."
0,Sewer rats could watch this movie and be so skeeved out that they'd need a shower.
3,Hard to resist.
1,"There's an excellent 90-minute film here; unfortunately, it runs for 170."
3,"Director Carl Franklin, so crisp and economical in One False Move, bogs down in genre cliches here."
2,"While the mystery unravels, the characters respond by hitting on each other."
3,"Like a precious and finely cut diamond, magnificent to behold in its sparkling beauty yet in reality it's one tough rock."
0,"No cute factor here... Not that I mind ugly; the problem is he has no character, loveable or otherwise."
