label,sentence
2,But it doesn't need Gangs of New York.
1,"The cinematic equivalent of patronizing a bar favored by pretentious, untalented artistes who enjoy moaning about their cruel fate."
3,There's a part of us that cannot help be entertained by the sight of someone getting away with something.
4,But Mr. Polanski creates images even more haunting than those in Mr. Spielberg's 1993 classic.
3,"The performances are strong, though the subject matter demands acting that borders on hammy at times."
1,"Never does ""Lilo & Stitch"" reach the emotion or timelessness of Disney's great past, or even that of more recent successes such as ""Mulan"" or ""Tarzan."""
4,A wild ride with eight boarders from Venice Beach that was a deserved co-winner of the Audience Award for documentaries at the Sundance Film Festival.
3,The mushy finale turns John Q into a movie-of-the-week tearjerker.
4,"A venturesome, beautifully realized psychological mood piece that reveals its first-time feature director's understanding of the expressive power of the camera."
3,that it'll probably be the best and most mature comedy of the 2002 summer season speaks more of the season than the picture
2,"It's still Adam Sandler, and it's not Little Nicky."
2,"Your nightmares, on the other hand, will be anything but."
0,My own minority report is that it stinks.
3,Cage makes an unusual but pleasantly haunting debut behind the camera.
3,Brosnan is more feral in this film than I've seen him before and Halle Berry does her best to keep up with him.
4,"Ben Kingsley is truly funny, playing a kind of Ghandi gone bad."
1,"Frankly, it's pretty stupid."
4,Ozpetek's effort has the scope and shape of an especially well-executed television movie.
3,Too clever by about nine-tenths.
2,You Should Pay Nine Bucks for This: Because you can hear about suffering Afghan refugees on the news and still be unaffected.
2,"The whole mildly pleasant outing -- the R rating is for brief nudity and a grisly corpse -- remains aloft not on its own self-referential hot air, but on the inspired performance of Tim Allen."
3,Horns and Halos benefits from serendipity but also reminds us of our own responsibility to question what is told as the truth.
0,"A particularly joyless, and exceedingly dull, period coming-of-age tale."
3,An unorthodox little film noir organized crime story that includes one of the strangest love stories you will ever see.
3,"Watching The Powerpuff Girls Movie, my mind kept returning to one anecdote for comparison: the cartoon in Japan that gave people seizures."
1,There's no good answer to that one.
3,"(While The Last Metro) was more melodramatic, confined to a single theater company and its strategies and deceptions, while Tavernier is more concerned with the entire period of history."
3,"Cantet beautifully illuminates what it means sometimes to be inside looking out, and at other times outside looking in."
3,"If you think it's a riot to see Rob Schneider in a young woman's clothes, then you'll enjoy The Hot Chick."
4,"With the same sort of good-natured fun found in films like Tremors, Eight Legged Freaks is prime escapist fare."
1,A bore that tends to hammer home every one of its points.
1,A non-mystery mystery.
3,"There's back-stabbing, inter-racial desire and, most importantly, singing and dancing."
1,There's more repetition than creativity throughout the movie.
3,"Together, Miller, Kuras and the actresses make Personal Velocity into an intricate, intimate and intelligent journey."
3,"I enjoyed the movie in a superficial way, while never sure what its purpose was."
2,"The film sometimes flags...but there is enough secondary action to keep things moving along at a brisk, amusing pace."
1,Fear Dot Com is more frustrating than a modem that disconnects every 10 seconds.
2,"Often overwrought and at times positively irritating, the film turns into an engrossing thriller almost in spite of itself."
1,"Instead of a witty expose on the banality and hypocrisy of too much kid-vid, we get an ugly, mean-spirited lashing out by an adult who's apparently been forced by his kids to watch too many Barney videos."
1,"Feels like the work of an artist who is simply tired -- of fighting the same fights, of putting the weight of the world on his shoulders, of playing with narrative form."
0,"It is very difficult to care about the character, and that is the central flaw of the film."
4,"Gangster No. 1 is solid, satisfying fare for adults."
1,Why did they deem it necessary to document all this emotional misery?
3,No doubt the star and everyone else involved had their hearts in the right place.
3,(Rises) above its oh-so-Hollywood rejiggering and its conventional direction to give the film a soul and an unabashed sense of good old-fashioned escapism.
2,Newcomer helmer Kevin Donovan is hamstrung by a badly handled screenplay of what is really an amusing concept – a high-tech tux that transforms its wearer into a superman.
2,This is the first film I've ever seen that had no obvious directing involved.
3,"captures that perverse element of the Kafkaesque where identity, overnight, is robbed and replaced with a persecuted ""other."""
3,Never once predictable.
1,"The film doesn't really care about the thousands of Americans who die hideously, it cares about how Ryan meets his future wife and makes his start at the CIA."
4,Offers a guilt-free trip into feel-good territory.
1,"The filmmakers are playing to the Big Boys in New York and L.A. To that end, they mock the kind of folks they don't understand, ones they figure the power-lunchers don't care to understand, either."
1,I wish it would have just gone more over-the-top instead of trying to have it both ways.
1,"The whole affair, true story or not, feels incredibly hokey... (it) comes off like a Hallmark commercial."
2,"(Allen's) been making piffle for a long while, and Hollywood Ending may be his way of saying that piffle is all that the airhead movie business deserves from him right now."
2,Cacoyannis is perhaps too effective in creating an atmosphere of dust-caked stagnation and labored gentility.
3,"The structure is simple, but in its own way, Rabbit-Proof Fence is a quest story as grand as The Lord of the Rings."
2,"O.K., not really."
1,A puppy dog so desperate for attention it nearly breaks its little neck trying to perform entertaining tricks.
3,Nice piece of work.
2,"(Kirshner wins, but it's close.)"
2,"A road trip that will get you thinking, 'Are we there yet?'"
1,The events of the film are just so WEIRD that I honestly never knew what the hell was coming next.
2,"The Ring is worth a look, if you don't demand much more than a few cheap thrills from your Halloween entertainment."
2,Who knew...
1,Episode II-- Attack of the Clones is a technological exercise that lacks juice and delight.
3,"This is a dark, gritty, sometimes funny little gem."
1,"Though there's a clarity of purpose and even-handedness to the film's direction, the drama feels rigged and sluggish."
1,"Noyce's greatest mistake is thinking that we needed sweeping, dramatic, Hollywood moments to keep us"
2,The Country Bears has no scenes that will upset or frighten young viewers.
3,What emerges is an unsettling picture of childhood innocence combined with indoctrinated prejudice.
4,"The 3-D vistas from orbit, with the space station suspended like a huge set of wind chimes over the great blue globe, are stanzas of breathtaking, awe-inspiring visual poetry."
1,"Cacoyannis' vision is far less mature, interpreting the play as a call for pity and sympathy for anachronistic phantasms haunting the imagined glory of their own pasts."
3,Jackie Chan movies are a guilty pleasure - he's easy to like and always leaves us laughing.
3,(Gayton's script) telegraphs every discovery and layers on the gloss of convenience.
3,"I know I shouldn't have laughed, but hey, those farts got to my inner nine-year-old."
0,"...has about 3/4th the fun of its spry 2001 predecessor -- but it's a rushed, slapdash, sequel-for-the-sake- of-a-sequel with less than half the plot and ingenuity."
3,There is a general air of exuberance in All About The Benjamins that's hard to resist.
1,"Plays like one of those conversations that Comic Book Guy on ""The Simpsons"" has."
2,A Sha-Na-Na sketch punctuated with graphic violence.
2,A drama?
1,"Dong never pushes for insights beyond the superficial tensions of the dynamic he's dissecting, and the film settles too easily along the contours of expectation."
3,"This charming but slight tale has warmth, wit and interesting characters compassionately portrayed."
0,The movie slides downhill as soon as macho action conventions assert themselves.
2,"Streamlined to a tight, brisk 85-minute screwball thriller, ""Big Trouble"" is funny, harmless and as substantial as a tub of popcorn with extra butter."
2,"As it stands, there's some fine sex onscreen, and some tense arguing, but not a whole lot more."
4,delightfully rendered
1,"Shows that Jackie Chan is getting older, and that's something I would rather live in denial about"
3,Many insightful moments.
2,It is a movie about passion.
1,"Made to be Jaglomized is the Cannes Film Festival, the annual Riviera spree of flesh, buzz, blab and money."
4,"The performances are immaculate, with Roussillon providing comic relief."
1,"Anyone not into high-tech splatterfests is advised to take the warning literally, and log on to something more user-friendly."
3,Director Claude Chabrol has become the master of innuendo.
3,"As comedic spotlights go, Notorious C.H.O. hits all the verbal marks it should."
1,(Tries) to parody a genre that's already a joke in the United States.
0,"They were afraid to show this movie to reviewers before its opening, afraid of the bad reviews they thought they'd earn."
4,Especially give credit to Affleck.
1,"A fragile framework upon which to hang broad, mildly fleshed-out characters that seem to have been conjured up only 10 minutes prior to filming."
3,And it marks him as one of the most interesting writer/directors working today.
0,"This picture is murder by numbers, and as easy to be bored by as your ABC's, despite a few whopping shootouts."
1,"Though Jones and Snipes are enthralling, the movie bogs down in rhetoric and cliché."
3,"According to Wendigo, 'nature' loves the members of the upper class almost as much as they love themselves."
0,"Even a hardened voyeur would require the patience of Job to get through this interminable, shapeless documentary about the swinging subculture."
4,It is refreshingly undogmatic about its characters.
0,"A gratingly unfunny groaner littered with zero-dimensional, unlikable characters and hackneyed, threadbare comic setups."
4,"A vibrant, colorful, semimusical rendition."
4,"But as you watch the movie, you're too interested to care."
1,"A mediocre exercise in target demographics, unaware that it's the butt of its own joke."
2,"The funny thing is, I didn't mind all this contrived nonsense a bit."
0,Thumbs down.
3,"While the story does seem pretty unbelievable at times, it's awfully entertaining to watch."
1,"At a time when we've learned the hard way just how complex international terrorism is, Collateral Damage paints an absurdly simplistic picture."
2,Adam SANDLER!
1,Upper West Sidey exercise in narcissism and self-congratulation disguised as a tribute.
3,"As a kind of colorful, dramatized PBS program, Frida gets the job done."
1,An uneven look into a grim future that doesn't come close to the level of intelligence and visual splendour that can be seen in other films based on Philip K. Dick stories.
3,"(Shyamalan) turns the goose-pimple genre on its empty head and fills it with spirit, purpose and emotionally bruised characters who add up to more than body count."
0,"Totally overwrought, deeply biased, and wholly designed to make you feel guilty about ignoring what the filmmakers clearly believe are The Greatest Musicians of All Time."
4,There's so much to look at in Metropolis you hate to tear your eyes away from the images long enough to read the subtitles.
1,Woody Allen used to ridicule movies like Hollywood Ending.
2,Either a fascinating study of the relationship between mothers and their children or a disturbing story about sociopaths and their marks.
3,Lightweight but appealing.
0,There is nothing redeeming about this movie.
1,What's infuriating about Full Frontal is that it's too close to real life to make sense.
2,Touché!
3,"The movie's seams may show...but Pellington gives ""Mothman"" an irresistibly uncanny ambience that goes a long way toward keeping the picture compelling."
4,"MacDowell ... gives give a solid, anguished performance that eclipses nearly everything else she's ever done."
3,"Director Paul Cox's unorthodox, abstract approach to visualizing Nijinsky's diaries is both stimulating and demanding."
3,"The sight of the spaceship on the launching pad is duly impressive in IMAX dimensions, as are shots of the astronauts floating in their cabins."
4,"The unique niche of self-critical, behind-the-scenes navel-gazing Kaufman has carved from Orleans' story and his own infinite insecurity is a work of outstanding originality."
3,The stunt work is top-notch; the dialogue and drama often food-spittingly funny.
1,"Lucas has in fact come closer than anyone could desire to the cheap, graceless, hackneyed sci-fi serials of the '30s and '40s."
3,"A fine effort, an interesting topic, some intriguing characters and a sad ending."
0,"""...something appears to have been lost in the translation this time."
3,Featherweight romantic comedy has a few nice twists in a standard plot and the charisma of Hugh Grant and Sandra Bullock.
0,"Hypnotically dull, relentlessly downbeat, laughably predictable wail pitched to the cadence of a depressed fifteen-year-old's suicidal poetry."
3,"Everything about The Quiet American is good, except its timing."
4,"It's a smartly directed, grown-up film of ideas."
3,"The Bourne Identity shouldn't be half as entertaining as it is, but director Doug Liman and his colleagues have managed to pack it with enough action to satisfy the boom-bam crowd without a huge sacrifice of character and mood."
1,"Once he starts learning to compromise with reality enough to become comparatively sane and healthy, the film becomes predictably conventional."
3,"A touching, small-scale story of family responsibility and care in the community."
1,"The gifted Crudup has the perfect face to play a handsome blank yearning to find himself, and his cipherlike personality and bad behavior would play fine if the movie knew what to do with him."
0,An artsploitation movie with too much exploitation and too little art.
2,An unflinching look at the world's dispossessed.
1,"Unless you're a fanatic, the best advice is: 'Scooby' don't."
3,"Nicole Kidman evolved from star to superstar some time over the past year, which means that Birthday Girl is the kind of quirkily appealing minor movie she might not make for a while."
3,And the positive change in tone here seems to have recharged him.
2,"The culmination of everyone's efforts is given life when A Selection appears in its final form (in ""Last Dance"")."
3,There's just something about watching a squad of psychopathic underdogs whale the tar out of unsuspecting lawmen that reaches across time and distance.
3,"The script is high on squaddie banter, low on shocks."
1,Go back to sleep.
0,This movie plays like an extended dialogue exercise in Retard 101.
2,"The movie is gorgeously made, but it is also somewhat shallow and art-conscious."
0,"It's as if a bored Cage spent the duration of the film's shooting schedule waiting to scream: ""Got AIDS yet?"""
4,"Secret Ballot is a funny, puzzling movie ambiguous enough to be engaging and oddly moving."
1,"A visionary marvel, but it's lacking a depth in storytelling usually found in anime like this."
0,"Nair just doesn't have the necessary self-control to guide a loose, poorly structured film through the pitfalls of incoherence and redundancy."
4,One of the most slyly exquisite anti-adult movies ever made.
1,This low-rent -- and even lower-wit -- rip-off of the Farrelly brothers' oeuvre gets way too mushy -- and in a relatively short amount of time.
4,Happily stays close to the ground in a spare and simple manner and doesn't pummel us with phony imagery or music.
0,"Fails as a dystopian movie, as a retooling of Fahrenheit 451, and even as a rip-off of The Matrix."
4,"Whatever one makes of its political edge, this is beautiful filmmaking from one of French cinema's master craftsmen."
4,"Jagger, Stoppard and director Michael Apted ... deliver a riveting and surprisingly romantic ride."
0,Banal and predictable.
1,"Takes a clunky TV-movie approach to detailing a chapter in the life of the celebrated Irish playwright, poet and drinker."
2,"Ritchie may not have a novel thought in his head, but he knows how to pose Madonna."
1,The trashy teen-sleaze equivalent of Showgirls.
2,"What Eric Schaeffer has accomplished with Never Again may not, strictly speaking, qualify as revolutionary."
4,"Best of all is Garcia, who perfectly portrays the desperation of a very insecure man."
1,"It doesn't flinch from its unsettling prognosis, namely, that the legacy of war is a kind of perpetual pain."
1,"Scooby-Doo doesn't know if it wants to be a retro-refitting exercise in campy recall for older fans or a silly, Nickelodeon-esque kiddie flick."
1,A dramatic comedy as pleasantly dishonest and pat as any Hollywood fluff.
0,"Unfunny and lacking any sense of commitment to or affection for its characters, the Reginald Hudlin comedy relies on toilet humor, ethnic slurs."
4,"""The best Disney movie since the Lion King"""
2,Merry friggin' Christmas!
4,"Best indie of the year, so far."
1,Feels less like a cousin to Blade Runner than like a bottom-feeder sequel in the Escape From New York series.
0,"It jumps around with little logic or continuity, presenting backstage bytes of information that never amount to a satisfying complete picture of this particular, anciently demanding métier."
3,Simone is not a bad film.
2,"Harry Potter and the Chamber of Secrets is deja vu all over again, and while that is a cliche, nothing could be more appropriate."
2,"Triumph of Love is a very silly movie, but the silliness has a pedigree."
4,"A sexy, peculiar and always entertaining costume drama set in Renaissance Spain, and the fact that it's based on true events somehow makes it all the more compelling."
1,"As the sulking, moody male hustler in the title role, (Franco) has all of Dean's mannerisms and self-indulgence, but none of his sweetness and vulnerability."
2,"Open-ended and composed of layer upon layer, Talk to Her is a cinephile's feast, an invitation to countless interpretations."
3,The first Bond movie in ages that isn't fake fun.
0,"The problem is that for the most part, the film is deadly dull."
0,"For the rest of us, sitting through Dahmer's two hours amounts to little more than punishment."
1,The rollerball sequences feel sanitised and stagey.
3,Ramsay and Morton fill this character study with poetic force and buoyant feeling.
2,Has all the right elements but completely fails to gel together.
3,The film is saved from aren't-kids-cute sentimentality by a warmth that isn't faked and a stately sense of composition.
3,"Death to Smoochy is often very funny, but what's even more remarkable is the integrity of DeVito's misanthropic vision."
2,"This is mild-mannered, been-there material given a pedestrian spin by a director who needed a touch of the flamboyant, the outrageous."
2,"You have once again entered the bizarre realm where director Adrian Lyne holds sway, where all relationships are simultaneously broadly metaphorical, oddly abstract, and excruciatingly literal."
1,The only young people who possibly will enjoy it are infants... who might be distracted by the movie's quick movements and sounds.
1,There's something fishy about a seasonal holiday kids' movie ... that derives its moment of most convincing emotional gravity from a scene where Santa gives gifts to grownups.
1,It collapses when Mr. Taylor tries to shift the tone to a thriller's rush.
0,It's also not smart or barbed enough for older viewers -- not everyone thinks poo-poo jokes are 'edgy.'
2,"Opening with some contrived banter, cliches and some loose ends, the screenplay only comes into its own in the second half."
1,"It gives poor Dana Carvey nothing to do that is really funny, and then expects us to laugh because he acts so goofy all the time."
3,"Efficient, suitably anonymous chiller."
0,"... Stylistically, the movie is a disaster."
3,"It's mildly entertaining, especially if you find comfort in familiarity."
3,...a guiltless film for nice evening out.
4,"What makes Salton Sea surprisingly engrossing is that Caruso takes an atypically hypnotic approach to a world that's often handled in fast-edit, hopped-up fashion."
1,An opportunity missed.
2,"Its strengths and weaknesses play off each other virtually to a stand-off, with the unfortunate trump card being the dreary mid-section of the film."
3,Canada's arctic light shines bright on this frozen tundra soap opera that breathes extraordinary life into the private existence of the Inuit people.
4,"Fresh and raw like a blown-out vein, Narc takes a walking-dead, cop-flick subgenre and beats new life into it."
1,Dignified CEO's meet at a rustic retreat and pee against a tree.
2,Helps to remind the First World that HIV/AIDS is far from being yesterday's news.
2,Some stunning visuals -- and some staggeringly boring cinema.
3,"A creepy, intermittently powerful study of a self-destructive man...about as unsettling to watch as an exploratory medical procedure or an autopsy."
1,"The overall vibe is druggy and self-indulgent, like a spring-break orgy for pretentious arts majors."
1,The Transporter bombards the viewer with so many explosions and side snap kicks that it ends up being surprisingly dull.
3,"Beneath the film's obvious determination to shock at any cost lies considerable skill and determination, backed by sheer nerve."
2,"The film may not hit as hard as some of the better drug-related pictures, but it still manages to get a few punches in."
1,"Perry's good and his is an interesting character, but ""Serving Sara"" hasn't much more to serve than silly fluff."
0,"The film's trailer also looked like crap, so crap is what I was expecting."
3,"The sentimental script has problems, but the actors pick up the slack."
3,Puts a refreshing and comical spin on the all-too-familiar saga of the contemporary single woman.
2,ending.
1,"There are some laughs in this movie, but Williams' anarchy gets tiresome, the satire is weak."
4,"Boisterous, heartfelt comedy."
1,"It's as if Allen, at 66, has stopped challenging himself."
1,"The characters seem one-dimensional, and the film is superficial and will probably be of interest primarily to its target audience."
3,"I'm sure mainstream audiences will be baffled, but, for those with at least a minimal appreciation of Woolf and Clarissa Dalloway, The Hours represents two of those well spent."
3,"Very amusing, not the usual route in a thriller, and the performances are odd and pixilated and sometimes both."
1,"If Festival in Cannes nails hard- boiled Hollywood argot with a bracingly nasty accuracy, much about the film, including some of its casting, is frustratingly unconvincing."
3,Coral Reef Adventure is a heavyweight film that fights a good fight on behalf of the world's endangered reefs -- and it lets the pictures do the punching.
3,"But it could be, by its art and heart, a necessary one."
1,I wanted more.
4,The entire cast is extraordinarily good.
1,"As if trying to grab a lump of Play-Doh, the harder that Liman tries to squeeze his story, the more details slip out between his fingers."
3,"A bracing, unblinking work that serves as a painful elegy and sobering cautionary tale."
2,It is one more celluloid testimonial to the cruelties experienced by Southern blacks as distilled through a Caucasian perspective.
4,"A fine, rousing, G-rated family film, aimed mainly at little kids but with plenty of entertainment value to keep grown-ups from squirming in their seats."
4,"It's immensely ambitious, different than anything that's been done before and amazingly successful in terms of what it's trying to do."
2,"Director-writer Bille August ... depicts this relationship with economical grace, letting his superb actors convey Martin's deterioration and Barbara's sadness -- and, occasionally, anger."
2,"Lavishly, exhilaratingly tasteless."
0,...a pretentious mess...
2,The first half bursts with a goofy energy previous Disney films only used for a few minutes here and there.
2,Feeling like a dope has rarely been more fun than it is in Nine Queens.
2,Too many improbabilities and rose-colored situations temper what could've been an impacting film.
4,It sends you away a believer again and quite cheered at just that.
1,"Terminally bland, painfully slow and needlessly confusing ... The movie, shot on digital videotape rather than film, is frequently indecipherable."
0,A very depressing movie of many missed opportunities.
4,Captures the raw comic energy of one of our most flamboyant female comics.
3,"If The Man from Elysian Fields is doomed by its smallness, it is also elevated by it--the kind of movie that you enjoy more because you're one of the lucky few who sought it out."
1,"Writer-director Walter Hill and co-writer David Giler try to create characters out of the obvious cliches, but wind up using them as punching bags."
1,"This wretchedly unfunny wannabe comedy is inane and awful - no doubt, it's the worst movie I've seen this summer."
1,"In the process of trimming the movie to an expeditious 84 minutes, director Roger Kumble seems to have dumped a whole lot of plot in favor of...outrageous gags."
3,"Singer/composer Bryan Adams contributes a slew of songs -- a few potential hits, a few more simply intrusive to the story -- but the whole package certainly captures the intended, er, spirit of the piece."
