label,sentence
2,"For a movie audience, The Hours doesn't connect in a neat way, but introduces characters who illuminate mysteries of sex, duty and love."
1,"What Madonna does here can't properly be called acting -- more accurately, it's moving and it's talking and it's occasionally gesturing, sometimes all at once."
4,Rifkin's references are ... impeccable throughout.
2,"Insomnia does not become one of those rare remakes to eclipse the original, but it doesn't disgrace it, either."
3,The director explores all three sides of his story with a sensitivity and an inquisitiveness reminiscent of Truffaut.
1,The fact that the 'best part' of the movie comes from a 60-second homage to one of Demme's good films doesn't bode well for the rest of it.
4,An enjoyable comedy of lingual and cultural differences... The Château is a film -- full of life and small delights -- that has all the wiggling energy of young kitten.
2,"Try Hell House, which documents the cautionary Christian spook-a-rama of the same name."
2,Tennessee Williams by way of Oprah's Book Club.
3,"An engaging, formulaic sports drama that carries a charge of genuine excitement."
1,Something must have been lost in the translation.
4,"Witty, contemplative, and sublimely beautiful."
4,Foster and Whitaker are especially fine.
3,"The lightest, most breezy movie Steven Spielberg has made in more than a decade."
1,"If I want a real movie, I'll buy the Criterion DVD."
3,"An earnest, roughshod document, it serves as a workable primer for the region's recent history, and would make a terrific 10th-grade learning tool."
4,A conventional but heartwarming tale.
3,"A sly female empowerment movie, although not in a way anyone would expect."
2,"There are a few modest laughs, but certainly no thrills."
0,The problem is the needlessly poor quality of its archival prints and film footage.
1,"There's something unintentionally comic in the film's drumbeat about authenticity, given the stale plot and pornographic way the film revels in swank apartments, clothes and parties."
3,Strange occurrences build in the mind of the viewer and take on extreme urgency.
2,"Almost everything about the film is unsettling, from the preposterous hairpiece worn by Lai's villainous father to the endless action sequences."
2,"It won't harm anyone, but neither can I think of a very good reason to rush right out and see it."
3,The formula is familiar but enjoyable.
1,"Its screenplay serves as auto-critique, and its clumsiness as its own most damning censure."
3,Less an examination of neo-Nazism than a probe into the nature of faith itself.
4,"Good performances and a realistic, non-exploitive approach make Paid in Full worth seeing."
2,"The Trinity Assembly approaches the endeavor with a shocking lack of irony, and George Ratliff's documentary, Hell House, reflects their earnestness -- which makes for a terrifying film."
1,Just isn't as weird as it ought to be.
4,"If you love the music, and I do, its hard to imagine having more fun watching a documentary ..."
1,"Watching Queen of the Damned is like reading a research paper, with special effects tossed in."
1,"Stinks from start to finish, like a wet burlap sack of gloom."
1,"The Merchant-Ivory team continues to systematically destroy everything we hold dear about cinema, only now it's begun to split up so that it can do even more damage."
3,"While there are times when the film's reach exceeds its grasp, the production works more often than it doesn't."
3,Hugely accomplished slice of Hitchcockian suspense.
1,Exhibits the shallow sensationalism characteristic of soap opera...more salacious telenovela than serious drama.
1,I'm sure there's a teenage boy out there somewhere who's dying for this kind of entertainment.
0,"Why sit through a crummy, wannabe-hip crime comedy that refers incessantly to old movies, when you could just rent those movies instead, let alone seek out a respectable new one?"
0,"A thoroughly awful movie--dumb, narratively chaotic, visually sloppy...a weird amalgam of 'The Thing' and a geriatric 'Scream.'"
1,"Contains the humor, characterization, poignancy, and intelligence of a bad sitcom."
0,"Laughably, irredeemably awful."
1,"One long, numbing action sequence made up mostly of routine stuff Yuen has given us before."
3,Together (Time Out and Human Resources) establish Mr. Cantet as France's foremost cinematic poet of the workplace.
4,"... a gleefully grungy, hilariously wicked black comedy ..."
2,"Everything its title implies, a standard-issue crime drama spat out from the Tinseltown assembly line."
3,"With Spy Kids 2: The Island of Lost Dreams, the Spy Kids franchise establishes itself as a durable part of the movie landscape: a James Bond series for kids."
3,Reno himself can take credit for most of the movie's success.
2,"Boldly engineering a collision between tawdry B-movie flamboyance and grandiose spiritual anomie, Rose's film, true to its source material, provides a tenacious demonstration of death as the great equalizer."
1,"Outside of Burger's desire to make some kind of film, it's really unclear why this project was undertaken"
1,"As for children, they won't enjoy the movie at all."
1,"If you saw it on TV, you'd probably turn it off, convinced that you had already seen that movie."
1,"While it is interesting to witness the conflict from the Palestinian side, Longley's film lacks balance ... and fails to put the struggle into meaningful historical context."
0,"Journalistically dubious, inept and often lethally dull."
4,"Brilliantly written and well-acted, Yellow Asphalt is an uncompromising film."
3,"Like Mike isn't going to make box office money that makes Michael Jordan jealous, but it has some cute moments, funny scenes, and hits the target audience (young Bow Wow fans) - with nothing but net."
2,Exposing the ways we fool ourselves is One Hour Photo's real strength.
4,The gags that fly at such a furiously funny pace that the only rip off that we were aware of was the one we felt when the movie ended so damned soon.
3,"While the path may be familiar, first-time director Denzel Washington and a top-notch cast manage to keep things interesting."
4,"Standing in the Shadows of Motown is the best kind of documentary, one that makes a depleted yesterday feel very much like a brand-new tomorrow."
2,The filmmaker's heart is in the right place...
1,"A series of escapades demonstrating the adage that what is good for the goose is also good for the gander, some of which occasionally amuses but none of which amounts to much of a story."
3,"J. Lo will earn her share of the holiday box office pie, although this movie makes one thing perfectly clear: She's a pretty woman, but she's no working girl."
4,"This documentary is a dazzling, remarkably unpretentious reminder of what (Evans) had, lost, and got back."
4,Their work is fantastic.
3,Much of the movie's charm lies in the utter cuteness of Stuart and Margolo.
1,Looks and feels like a low-budget hybrid of Scarface or Carlito's Way.
0,"A profoundly stupid affair, populating its hackneyed and meanspirited storyline with cardboard characters and performers who value cash above credibility."
1,"Like its script, which nurses plot holes gaping enough to pilot an entire Olympic swim team through, the characters in Swimfan seem motivated by nothing short of dull, brain-deadening hangover."
2,"Jonah is only so-so... the addition of a biblical message will either improve the film for you, or it will lessen it."
1,Do we really need the Tiger Beat version?
3,"If it's unnerving suspense you're after -- you'll find it with Ring, an indisputably spooky film; with a screenplay to die for."
4,"Gosling creates a staggeringly compelling character, a young man whose sharp intellect is at the very root of his contradictory, self-hating, self-destructive ways."
3,A beautiful paean to a time long past.
2,"A highly personal look at the effects of living a dysfunctionally privileged lifestyle, and by the end, we only wish we could have spent more time in its world."
3,"An extremely funny, ultimately heartbreaking look at life in contemporary China."
3,"Sheds light on a subject few are familiar with, and makes you care about music you may not have heard before."
2,"Bad in such a bizarre way that it's almost worth seeing, if only to witness the crazy confluence of purpose and taste."
2,An ambitious and moving but bleak film.
1,"But for the most part, The Weight of Water comes off as a two-way time-switching myopic mystery that stalls in its lackluster gear of emotional blandness."
1,And Diesel isn't the actor to save it.
2,Only those most addicted to film violence in all its forms will find anything here to appreciate.
1,A feeble Tootsie knockoff.
3,See it for his performance if nothing else.
3,Terrific casting and solid execution give all three stories life.
1,The skirmishes for power waged among victims and predators settle into an undistinguished rhythm of artificial suspense.
0,A thriller without a lot of thrills.
3,Yet the act is still charming here.
2,Strictly middle of the road.
4,Far more enjoyable than its predecessor.
2,I was sent a copyof this film to review on DVD.
3,"A moving essay about the specter of death, especially suicide."
3,"Phillip Noyce and all of his actors -- as well as his cinematographer, Christopher Doyle -- understand the delicate forcefulness of Greene's prose, and it's there on the screen in their version of The Quiet American."
3,"Though it runs 163 minutes, Safe Conduct is anything but languorous."
2,Barry Sonnenfeld owes Frank the Pug big time
0,"This is the kind of movie that you only need to watch for about thirty seconds before you say to yourself, 'Ah, yes, here we have a bad, bad, bad movie.'"
3,"Even at its worst, it's not half-bad."
4,"...even if you've never heard of Chaplin, you'll still be glued to the screen."
0,"A long, dull procession of despair, set to cello music culled from a minimalist funeral."
2,"I would be shocked if there was actually one correct interpretation, but that shouldn't make the movie or the discussion any less enjoyable."
3,"The concert footage is stirring, the recording sessions are intriguing, and -- on the way to striking a blow for artistic integrity -- this quality band may pick up new admirers."
0,Most of the dialogue made me want to pack raw dough in my ears.
2,Vividly conveys the shadow side of the 30-year friendship between two English women.
1,Queen of the Damned is too long with too little going on.
2,"Whatever about warning kids about the dangers of ouija boards, someone should dispense the same advice to film directors."
2,The sound of GUNFIRE and cell phones RINGING.
3,"It ain't art, by a long shot, but unlike last year's lame Musketeer, this Dumas adaptation entertains."
3,Campanella's competent direction and his excellent cast overcome the obstacles of a predictable outcome and a screenplay that glosses over Rafael's evolution.
3,Schütte's dramatic snapshot of the artist three days before his death offers an interesting bit of speculation as to the issues Brecht faced as his life drew to a close.
3,"Would be an unendurable viewing experience for this ultra-provincial New Yorker if 26-year-old Reese Witherspoon were not on hand to inject her pure fantasy character, Melanie Carmichael, with a massive infusion of old-fashioned Hollywood magic."
1,"A horror movie with seriously dumb characters, which somewhat dilutes the pleasure of watching them stalked by creepy-crawly bug things that live only in the darkness."
0,Their parents would do well to cram earplugs in their ears and put pillowcases over their heads for 87 minutes.
1,Cloaks a familiar anti-feminist equation (career - kids = misery) in tiresome romantic-comedy duds.
3,Naomi Watts is terrific as Rachel; her petite frame and vulnerable persona emphasising her plight and isolation.
0,Idiotic and ugly.
3,"'Film aficionados cannot help but love Cinema Paradiso, whether the original version or new Director's Cut.'"
2,"If you can keep your eyes open amid all the blood and gore, you'll see Del Toro has brought unexpected gravity to Blade II."
4,"Hard, endearing, caring, warm."
1,The major problem with Windtalkers is that the bulk of the movie centers on the wrong character.
1,-greaseballs mob action-comedy.
2,Visually exciting sci-fi film which suffers from a lackluster screenplay.
4,Writer and director Otar Iosseliani's pleasant tale about a factory worker who escapes for a holiday in Venice reveals how we all need a playful respite from the grind to refresh our souls.
4,"A refreshingly realistic, affectation-free coming-of-age tale."
4,"""Simone"" is a fun and funky look into an artificial creation in a world that thrives on artificiality."
2,Is truth stranger than fiction?
1,"Supposedly, Pokemon can't be killed, but Pokemon 4Ever practically assures that the pocket monster movie franchise is nearly ready to keel over."
0,"The acting is amateurish, the cinematography is atrocious, the direction is clumsy, the writing is insipid and the violence is at once luridly graphic and laughably unconvincing."
2,It's the type of stunt the Academy loves: a powerful political message stuffed into an otherwise mediocre film.
4,You have to see it.
3,Pray has really done his subject justice.
2,"Some elements of it really blow the big one, but other parts are decent."
2,Will you go ape over this movie?
2,...the implication is Kissinger may have decided that -- when it comes to truncheoning -- it's better to give than to receive.
1,"Woody, what happened?"
1,But it's also disappointing to a certain degree.
0,"Coarse, cliched and clunky, this trifling romantic comedy in which opposites attract for no better reason than that the screenplay demands it squanders the charms of stars Hugh Grant and Sandra Bullock."
1,Bears about as much resemblance to the experiences of most battered women as Spider-Man does to the experiences of most teenagers.
3,"At times a bit melodramatic and even a little dated (depending upon where you live), Ignorant Fairies is still quite good-natured and not a bad way to spend an hour or two."
1,"A boring masquerade ball where normally good actors, even Kingsley, are made to look bad."
0,A semi-autobiographical film that's so sloppily written and cast that you cannot believe anyone more central to the creation of Bugsy than the caterer had anything to do with it.
1,The skills of a calculus major at M.I.T. are required to balance all the formulaic equations in the long-winded heist comedy Who Is Cletis Tout?
1,"Though there are entertaining and audacious moments, the movie's wildly careening tone and an extremely flat lead performance do little to salvage this filmmaker's flailing reputation."
3,"Efteriades gives the neighborhood -- scenery, vibe and all -- the cinematic equivalent of a big, tender hug."
3,Two Weeks Notice has appeal beyond being a Sandra Bullock vehicle or a standard romantic comedy.
3,"Could use a little more humanity, but it never lacks in eye-popping visuals."
4,"The leads are natural and lovely, the pace is serene, the humor wry and sprightly."
1,"Offers big, fat, dumb laughs that may make you hate yourself for giving in."
3,Hardly a film that comes along every day.
4,Definitely worth 95 minutes of your time.
3,Certainly the big finish wasn't something Galinsky and Hawley could have planned for... but part of being a good documentarian is being there when the rope snaps.
0,"Rollerball IS as bad as you think, and worse than you can imagine."
1,"There's the plot, and a maddeningly insistent and repetitive piano score that made me want to scream."
0,"It would be great to see this turd squashed under a truck, preferably a semi."
2,"""It's all about the image."""
0,"The pacing is deadly, the narration helps little and Naipaul, a juicy writer, is negated."
2,"This may be Dover Kosashvili's feature directing debut, but it looks an awful lot like life -- gritty, awkward and ironic."
3,I'm going to give it a marginal thumbs up.
4,This beautifully animated epic is never dull.
1,"Human Nature, in short, isn't nearly as funny as it thinks it is; neither is it as smart."
4,Davis ... gets vivid performances from her cast and pulls off some deft Ally McBeal-style fantasy sequences.
1,"Even in the summertime, the most restless young audience deserves the dignity of an action hero motivated by something more than franchise possibilities."
2,"An enigmatic film that's too clever for its own good, it's a conundrum not worth solving."
2,Neither a rousing success nor a blinding embarrassment.
4,A mesmerizing cinematic poem from the first frame to the last.
1,"The setting turns out to be more interesting than any of the character dramas, which never reach satisfying conclusions."
0,This painfully unfunny farce traffics in tired stereotypes and encumbers itself with complications ... that have no bearing on the story.
3,Take nothing seriously and enjoy the ride.
2,"Any intellectual arguments being made about the nature of God are framed in a drama so clumsy, there is a real danger less sophisticated audiences will mistake it for an endorsement of the very things that Bean abhors."
4,"It is different from others in its genre in that it is does not rely on dumb gags, anatomical humor, or character cliches; it primarily relies on character to tell its story."
4,"Still rapturous after all these years, Cinema Paradiso stands as one of the great films about movie love."
3,Be patient with the lovely Hush!
4,"The actors are simply too good, and the story too intriguing, for technical flaws to get in the way."
3,I'd be lying if I said my ribcage didn't ache by the end of Kung Pow.
4,It may also be the best sex comedy about environmental pollution ever made.
3,"An entertaining, if ultimately minor, thriller."
3,"And the reason for that is a self-aware, often self-mocking, intelligence."
0,Whether Jason X is this bad on purpose is never clear.
0,"All comedy is subversive, but this unrelenting bleak insistence on opting out of any opportunity for finding meaning in relationships or work just becomes sad."
0,"The movie is concocted and carried out by folks worthy of scorn, and the nicest thing I can say is that I can't remember a single name responsible for it."
1,All too familiar...basically the sort of cautionary tale that was old when 'Angels With Dirty Faces' appeared in 1938.
1,Seems like something American and European gay movies were doing 20 years ago.
1,"This is a truly, truly bad movie."
4,"The way the roundelay of partners functions, and the interplay within partnerships and among partnerships and the general air of Gator-bashing are consistently delightful."
2,"Both flawed and delayed, Martin Scorcese's Gangs of New York still emerges as his most vital work since GoodFellas."
1,What 'Blade Runner' would've looked like as a low-budget series on a UHF channel.
1,There is a difference between movies with the courage to go over the top and movies that don't care about being stupid
3,An ebullient Tunisian film about the startling transformation of a tradition-bound widow who is drawn into the exotic world of belly dancing.
3,A lovely film for the holiday season.
2,"... Ice Age treads predictably along familiar territory, making it a passable family film that won't win many fans over the age of 12."
3,"After one gets the feeling that the typical Hollywood disregard for historical truth and realism is at work here, it's a matter of finding entertainment in the experiences of Zishe and the fiery presence of Hanussen."
3,"Tadpole may be one of the most appealing movies ever made about an otherwise appalling, and downright creepy, subject -- a teenage boy in love with his stepmother."
4,"A film centering on a traditional Indian wedding in contemporary New Delhi may not sound like specialized fare, but Mira Nair's film is an absolute delight for all audiences."
2,"When you think you've figured out Bielinsky's great game, that's when you're in the most trouble: He's the con, and you're just the mark."
4,"The most amazing super-sized dosage of goofball stunts any ""Jackass"" fan could want."
3,"K-19: The Widowmaker is derivative, overlong, and bombastic -- yet surprisingly entertaining."
1,"Every visual joke is milked, every set-up obvious and lengthy, every punchline predictable."
0,"By that measure, it is a failure."
1,"Rather than real figures, Elling and Kjell Bjarne become symbolic characters whose actions are supposed to relate something about the naïf's encounter with the world."
3,"Seeing as the film lacks momentum and its position remains mostly undeterminable, the director's experiment is a successful one."
0,...a pretentious mess...
1,"Full of flatulence jokes and mild sexual references, Kung Pow!"
2,"""13 Conversations"" holds its goodwill close, but is relatively slow to come to the point."
1,"So mind-numbingly awful that you hope Britney won't do it one more time, as far as movies are concerned."
4,"Laced with liberal doses of dark humor, gorgeous exterior photography, and a stable-full of solid performances, No Such Thing is a fascinating little tale."
4,"In the new release of Cinema Paradiso, the tale has turned from sweet to bittersweet, and when the tears come during that final, beautiful scene, they finally feel absolutely earned."
3,Remove Spider-Man the movie from its red herring surroundings and it's apparent that this is one summer film that satisfies.
1,"Spectators will indeed sit open-mouthed before the screen, not screaming but yawning."
4,", The Sum of All Fears is simply a well-made and satisfying thriller."
2,"(Raimi's) matured quite a bit with Spider-Man, even though it's one of the most plain white toast comic book films you'll ever see."
3,What makes the movie special is its utter sincerity.
0,The thing just never gets off the ground.
0,"After several scenes of this tacky nonsense, you'll be wistful for the testosterone-charged wizardry of Jerry Bruckheimer productions, especially because Half Past Dead is like The Rock on a Wal-Mart budget."
3,The film oozes craft.
0,"Once the expectation of laughter has been quashed by whatever obscenity is at hand, even the funniest idea isn't funny."
4,"Funny, sexy, devastating and incurably romantic."
2,"Eastwood winces, clutches his chest and gasps for breath."
2,And how.
1,"An ambitious, guilt-suffused melodrama crippled by poor casting."
2,Not one moment in the enterprise didn't make me want to lie down in a dark room with something cool to my brow.
2,Norton holds the film together.
1,This is an exercise not in biography but in hero worship.
1,The densest distillation of Roberts' movies ever made.
4,"With this masterful, flawless film, (Wang) emerges in the front ranks of China's now numerous, world-renowned filmmakers."
4,A live-wire film that never loses its ability to shock and amaze.
1,"Throughout all the tumult, a question comes to mind: So why is this so boring?"
2,"Ong chooses to present Ah Na's life as a slight, weightless fairy tale, whose most unpleasant details seem to melt away in the face of the character's blank-faced optimism."
4,The large-format film is well suited to capture these musicians in full regalia and the incredible IMAX sound system lets you feel the beat down to your toes.
4,"A finely tuned mood piece, a model of menacing atmosphere."
2,"Egoyan's work often elegantly considers various levels of reality and uses shifting points of view, but here he has constructed a film so labyrinthine that it defeats his larger purpose."
2,An original little film about one young woman's education.
2,"By the end, you just don't care whether that cold-hearted snake Petrovich (that would be Reno) gets his comeuppance."
4,"It's packed with adventure and a worthwhile environmental message, so it's great for the kids."
1,Too bad Maggio couldn't come up with a better script.
4,"Sensual, funny and, in the end, very touching."
3,"A movie just for Friday fans, critics be damned."
2,"Charming, if overly complicated..."
4,It's a fairy tale that comes from a renowned Indian film culture that allows Americans to finally revel in its splendor.
2,Will no doubt delight Plympton's legion of fans; others may find 80 minutes of these shenanigans exhausting.
1,All mood and no movie.
2,"The movie ultimately relies a bit too heavily on grandstanding, emotional, Rocky-like moments ... but it's such a warm and charming package that you'll feel too happy to argue much."
4,"Will assuredly rank as one of the cleverest, most deceptively amusing comedies of the year."
2,What a vast enterprise has been marshaled in the service of such a minute idea.
0,A half-assed film.
3,"It's truly awful and heartbreaking subject matter, but one whose lessons are well worth revisiting as many times as possible."
4,The most ingenious film comedy since Being John Malkovich.
2,Being latently gay and liking to read are hardly enough.
4,"The cast is phenomenal, especially the women."
3,"Inventive, fun, intoxicatingly sexy, violent, self-indulgent and maddening."
2,Director Oliver Parker labors so hard to whip life into The Importance of Being Earnest that he probably pulled a muscle or two.
4,"Much of it comes from the brave, uninhibited performances by its lead actors."
0,A chiller resolutely without chills.
2,"while (Roman Coppola) scores points for style, he staggers in terms of story."
1,"The first hour is tedious though Ford and Neeson capably hold our interest, but its just not a thrilling movie."
3,And it is.
3,"Even when it drags, we are forced to reflect that its visual imagination is breathtaking"
2,Mildly amusing.
1,Imperfect?
2,"Missteps take what was otherwise a fascinating, riveting story and send it down the path of the mundane."
0,This mess of a movie is nothing short of a travesty of a transvestite comedy.
1,"A baffling subplot involving smuggling drugs inside Danish cows falls flat, and if you're going to alter the Bard's ending, you'd better have a good alternative."
